{
  "agent": {
    "adapter_type": "codex_cli",
    "command": null,
    "command_prefix": [
      "npx",
      "-y",
      "@openai/codex@0.158.0"
    ],
    "framework": "codex-cli-0.158.0",
    "mock_script": null,
    "model_id": "gpt-6-luna",
    "model_version": null,
    "provider": "openai",
    "scaffold_id": "neutral_optics_v1"
  },
  "concurrency": 1,
  "created_utc": "2026-09-28T18:08:52.623572+00:00",
  "execution_class": "real",
  "output_directory": "2026-09-28-openai-gpt-6-luna-rc1-variant-probe",
  "pricing_snapshot": null,
  "protocol_ids": [
    "closed_book"
  ],
  "release_id": "0.1.0-rc1",
  "retrieval_config": {
    "max_items": 3
  },
  "retry_policy": {
    "transport_max_retries": 0,
    "malformed_answer_max_retries": 0,
    "self_correction_max_retries": 0
  },
  "run_id": "2026-09-28-openai-gpt-6-luna-rc1-variant-probe",
  "runner_version": "0.1.0",
  "schema_version": "0.1.0",
  "seed": null,
  "selections": [
    {
      "case_id": "SEED-1-1",
      "track": "public_variant",
      "variant_path": "benchmark/variants/public_dev/VAR-SEED-1-1-P-c8828a9799d3.json"
    },
    {
      "case_id": "SEED-1-5",
      "track": "public_variant",
      "variant_path": "benchmark/variants/public_dev/VAR-SEED-1-5-U-72b8d7fedf9d.json"
    },
    {
      "case_id": "SEED-1-7",
      "track": "public_variant",
      "variant_path": "benchmark/variants/public_dev/VAR-SEED-1-7-P-993c62b0f08c.json"
    },
    {
      "case_id": "SEED-2-2",
      "track": "public_variant",
      "variant_path": "benchmark/variants/public_dev/VAR-SEED-2-2-U-e2686bf1bc46.json"
    },
    {
      "case_id": "SEED-4-2",
      "track": "public_variant",
      "variant_path": "benchmark/variants/public_dev/VAR-SEED-4-2-P-cbd86d5fb68e.json"
    }
  ],
  "system_prompt_version": "neutral_optics_v1",
  "timeout_seconds": 300,
  "tool_config": {
    "max_calls": 6,
    "profile_id": "generic_computation_v0.1"
  }
}
