{
  "agent": {
    "adapter_type": "codex_cli",
    "command": null,
    "command_prefix": [
      "npx",
      "-y",
      "@openai/codex@0.158.0"
    ],
    "framework": "codex-cli-0.158.0",
    "mock_script": null,
    "model_id": "gpt-6-astra",
    "model_version": null,
    "provider": "openai",
    "scaffold_id": "neutral_optics_v1"
  },
  "concurrency": 1,
  "created_utc": "2026-09-28T18:08:14.362672+00:00",
  "execution_class": "real",
  "output_directory": "2026-09-28-openai-gpt-6-astra-020rc1-formal",
  "pricing_snapshot": null,
  "protocol_ids": [
    "closed_book",
    "case_assisted",
    "tool_assisted",
    "case_and_tool_assisted"
  ],
  "release_id": "0.2.0-rc1",
  "retrieval_config": {
    "max_items": 3
  },
  "retry_policy": {
    "transport_max_retries": 0,
    "malformed_answer_max_retries": 0,
    "self_correction_max_retries": 0
  },
  "run_id": "2026-09-28-openai-gpt-6-astra-020rc1-formal",
  "runner_version": "0.1.0",
  "schema_version": "0.1.0",
  "seed": null,
  "selections": [
    {
      "case_id": "SEED-1-1",
      "track": "verified",
      "variant_path": null
    },
    {
      "case_id": "SEED-1-5",
      "track": "verified",
      "variant_path": null
    },
    {
      "case_id": "SEED-1-7",
      "track": "verified",
      "variant_path": null
    },
    {
      "case_id": "SEED-2-2",
      "track": "verified",
      "variant_path": null
    },
    {
      "case_id": "SEED-4-2",
      "track": "verified",
      "variant_path": null
    },
    {
      "case_id": "SEED-2-1",
      "track": "verified",
      "variant_path": null
    },
    {
      "case_id": "SEED-3-1",
      "track": "verified",
      "variant_path": null
    },
    {
      "case_id": "SEED-3-7",
      "track": "verified",
      "variant_path": null
    },
    {
      "case_id": "SEED-5-5",
      "track": "verified",
      "variant_path": null
    }
  ],
  "system_prompt_version": "neutral_optics_v1",
  "timeout_seconds": 300,
  "tool_config": {
    "max_calls": 6,
    "profile_id": "generic_computation_v0.1"
  }
}
